,Unnamed: 0,Title,Author,Publication_Year,Link,Abstract,Repository,Topic_Category,Year,Country(s)
0,0,A Continent-Wide Assessment of Cyber Vulnerability Across Africa,"Abdijabar Yussuf Mohamed, Samuel Kang'ara Kamau",2023-01-08,http://arxiv.org/pdf/2301.03008v1,"As the internet penetration rate in Africa increases, so does the
proliferation of the Internet of Things (IoT) devices. Along with this growth
in internet access is the risk of cyberattacks to vulnerable IoT devices
mushrooming in the African cyberspace. One way to determine IoT vulnerabilities
is to find open ports within Africa s cyberspace. Our research leverages Shodan
search engine, a powerful tool for discovering IoT devices facing the public
internet, to find open ports across Africa. We conduct an analysis of our
findings, ranking countries from most to least vulnerable to cyberattack. We
find that South Africa,Tunisia, Morocco, Egypt, and Nigeria are the five
countries most susceptible to cyberattack on the continent. Further, 69.8% of
devices having one of the five most commonly open internet ports have had past
documented vulnerabilities. Following our analysis, we conclude with policy
recommendations for both the public and private sector.",arxiv,Cybersecurity,2023,"South Africa, Tunisia, Morocco, Egypt, Nigeria"
1,1,Physics Masterclasses in Africa and the World,"Uta Bilow, Kenneth Cecire",2022-05-24,http://arxiv.org/pdf/2206.07004v1,"International Masterclasses (IMC) enable high school students and teachers to
work with particle physicists to analyze authentic data from contemporary
experiments and experience being ""physicists for a day"". The IMC program has a
worldwide reach, including several universities and research institutes in
Egypt, Algeria, Morocco, Sao Tom'e and Principe, and South Africa. As technical
infrastructure in Africa improves, there is a great opportunity for many more
African institutes to offer IMC on their premises. The authors will discuss the
advantages of IMC to Africa, how institutes may join, and ways to overcome
obstacles.",arxiv,Physics Education,2022,"Egypt, Algeria, Morocco, Sao Tomé and Principe, South Africa"
2,2,Modelling spatio-temporal trends of air pollution in Africa,"Paterne Gahungu, Jean Remy Kubwimana, Lionel Jean Marie Benjamin Muhimpundu, Egide Ndamuzi",2022-08-21,http://arxiv.org/pdf/2208.12719v1,"Atmospheric pollution remains one of the major public health threat worldwide
with an estimated 7 millions deaths annually. In Africa, rapid urbanization and
poor transport infrastructure are worsening the problem. In this paper, we have
analysed spatio-temporal variations of PM2.5 across different geographical
regions in Africa. The West African region remains the most affected by the
high levels of pollution with a daily average of 40.856 $\mu g/m^3$ in some
cities like Lagos, Abuja and Bamako. In East Africa, Uganda is reporting the
highest pollution level with a daily average concentration of 56.14 $\mu g/m^3$
and 38.65 $\mu g/m^3$ for Kigali. In countries located in the central region of
Africa, the highest daily average concentration of PM2.5 of 90.075 $\mu g/m^3$
was recorded in N'Djamena. We compare three data driven models in predicting
future trends of pollution levels. Neural network is outperforming Gaussian
processes and ARIMA models.",arxiv,Environmental Science,2022,"Africa, Nigeria, Uganda, Rwanda, Chad"
3,3,Radio astronomy in Africa: the case of Ghana,"Bernard Duah Asabere, Michael Gaylard, Cathy Horellou, Hartmut Winkler, Thomas Jarrett",2015-03-30,http://arxiv.org/pdf/1503.08850v2,"South Africa has played a leading role in radio astronomy in Africa with the
Hartebeesthoek Radio Astronomy Observatory (HartRAO). It continues to make
strides with the current seven-dish MeerKAT precursor array (KAT-7), leading to
the 64-dish MeerKAT and the giant Square Kilometer Array (SKA), which will be
used for transformational radio astronomy research. Ghana, an African partner
to the SKA, has been mentored by South Africa over the past six years and will
soon emerge in the field of radio astronomy. The country will soon have a
science-quality 32m dish converted from a redundant satellite communication
antenna. Initially, it will be fitted with 5 GHz and 6.7 GHz receivers to be
followed later by a 1.4 - 1.7 GHz receiver. The telescope is being designed for
use as a single dish observatory and for participation in the developing
African Very Long Baseline Interferometry (VLBI) Network (AVN) and the European
VLBI Network. Ghana is earmarked to host a remote station during a possible SKA
Phase 2. The location of the country on 5 degree north of the Equator gives it
the distinct advantage of viewing the entire plane of the Milky Way galaxy and
nearly the whole sky. In this article, we present the case of Ghana in the
radio astronomy scene and the science/technology that will soon be carried out
by engineers and astronomers.",arxiv,Astronomy,2015,"South Africa, Ghana"
4,4,Modelling the impact of vaccination on the COVID-19 pandemic in African countries,"Dephney Mathebula, Abigail Amankwah, Kossi Amouzouvi, Kétévi A. Assamagan, Somiéalo Azote, Jesutofunmi Ayo Fajemisin, Jean Baptiste Fankam Fankam, Aluwani Guga, Moses Kamwela, Toivo S. Mabote, Mulape M Kanduza, Francisco Fenias Macucule, Azwinndini Muronga, Ann Njeri, Michael Oluwole, Cláudio Moisés Paulo",2022-09-19,http://arxiv.org/pdf/2209.08694v4,"The rapid development of vaccines to combat the spread of COVID-19 disease
caused by the SARS-CoV-2 virus is a great scientific achievement. Before the
development of the COVID-19 vaccines, most studies capitalized on the available
data that did not include pharmaceutical measures. Such studies focused on the
impact of non-pharmaceutical measures (e.g social distancing, sanitation,
wearing of face masks, and lockdown) to study the spread of COVID-19. In this
study, we used the SIDARTHE-V model which is an extension of the SIDARTHE model
wherein we include vaccination roll outs. We studied the impact of vaccination
on the severity (deadly nature) of the virus in African countries. Model
parameters were extracted by fitting simultaneously the COVID-19 cumulative
data of deaths, recoveries, active cases, and full vaccinations reported by the
governments of Ghana, Kenya, Mozambique, Nigeria, South Africa, Togo, and
Zambia. With countries having some degree of variation in their vaccination
programs, we considered the impact of vaccination campaigns on the death rates
in these countries. The study showed that the cumulative death rates declined
drastically with the increased extent of vaccination in each country; while
infection rates were sometimes increasing with the arrival of new waves, the
death rates did not increase as we saw before vaccination.",arxiv,Epidemiology,2022,"Ghana, Kenya, Mozambique, Nigeria, South Africa, Togo, Zambia"
5,5,Rwandacoin: Prospects and challenges of developing a cryptocurrency for transactions in Rwanda,"Oluwafunmilola Kesa, Violette Mahoro",2019-01-11,http://arxiv.org/pdf/1901.06249v1,"The use of cryptocurrencies such as Bitcoin and Ethereum in performing online
transactions has been on the rise in the world. Africa as a continent is not
left out in the adoption of blockchain and cryptocurrencies. This paper
explores the prospects and challenges of developing a cryptocurrency in Rwanda
which we denote Rwandacoin. In addition, the paper discusses the potentials of
Rwandacoin easing intercountry trading in East Africa.",arxiv,Economics,2019,Rwanda
6,6,African Democracy in the Era of Generative Disinformation: Challenges and Countermeasures against AI-Generated Propaganda,Chinasa T. Okolo,2024-07-10,http://arxiv.org/pdf/2407.07695v1,"In light of prominent discourse around the negative implications of
generative AI, an emerging area of research is investigating the current and
estimated impacts of AI-generated propaganda on African citizens participating
in elections. Throughout Africa, there have already been suspected cases of
AI-generated propaganda influencing electoral outcomes or precipitating coups
in countries like Nigeria, Burkina Faso, and Gabon, underscoring the need for
comprehensive research in this domain. This paper aims to highlight the risks
associated with the spread of generative AI-driven disinformation within Africa
while concurrently examining the roles of government, civil society, academia,
and the general public in the responsible development, practical use, and
robust governance of AI. To understand how African governments might
effectively counteract the impact of AI-generated propaganda, this paper
presents case studies illustrating the current usage of generative AI for
election-related propaganda in Africa. Subsequently, this paper discusses
efforts by fact-checking organisations to mitigate the negative impacts of
disinformation, explores the potential for new initiatives to actively engage
citizens in literacy efforts to combat disinformation spread, and advocates for
increased governmental regulatory measures. Overall, this research seeks to
increase comprehension of the potential ramifications of AI-generated
propaganda on democratic processes within Africa and propose actionable
strategies for stakeholders to address these multifaceted challenges.",arxiv,Political Science,2024,"Nigeria, Burkina Faso, Gabon"
7,7,Impact of contamination factors on the COVID-19 evolution in Senegal,"Vieux Medoune Ndiaye, Serigne Omar Sarr, Babacar Mbaye Ndiaye",2020-06-29,http://arxiv.org/pdf/2006.16326v1,"In this article, we perform an analysis of COVID-19 on one of the South
Saharan countries (hot zone), the Senegal (West Africa). Many questions remain
unanswered: why the African continent is not very contaminated compared to
other continents. Factors of cross immunity, temperature, population density,
youth, etc. are taken into account for an analysis of the contamination
factors. Numerical simulations are carried out for a prediction over the coming
week.",arxiv,Public Health,2020,Senegal
8,8,Predicting Insurance Penetration Rate in Ghana Using the Autoregressive Integrated Moving Average (ARIMA) Model,"Thomas Gyima-Adu, Godwin Gidisu",2025-02-11,http://arxiv.org/pdf/2502.07841v1,"Ghana records a low penetration of 1.05% compared to some of its African
counterparts. For example South Africa, which has an insurance penetration rate
of 17%, followed by Namibia which records 6.3%. This means, there is more room
for improvement. More upsetting, with Ghana hovering around the 1% as at 2018,
the rate works out to the small amount of Gross Domestic Product. This research
seeks to model and forecast insurance penetration rate in Ghana using the
Autoregressive Integrated Moving Average technique. The result indicates that
ARIMA (3,1,0) is the appropriate model for insurance penetration in Ghana.
Also, results from the forecast could serve as an advisory or the need to
re-strategize as a country. Therefore, determining the future pattern of
insurance penetration will lead to the remedies that will increase the number
of insured in the future.",arxiv,Economics,2025,"Ghana, South Africa, Namibia"
9,9,Development in astronomy in Ethiopia and East-Africa through nuclear activity in galaxies,Mirjana Pović,2020-04-26,http://arxiv.org/pdf/2004.12434v1,"In this paper we summarise the research that is currently going on in
Ethiopia and East-Africa in extragalactic astronomy and physics of active
galaxies and active galactic nuclei (AGN). The study is focused on some of the
still open questions such as: what are the stellar ages and populations of
ultra hard X-ray detected AGN and connection between AGN and their host
galaxies?, what are the properties of AGN in galaxy clusters and the role that
environment has in triggering nuclear activity?, what are the morphological
properties of AGN and how precisely we can deal with morphological
classification of active galaxies?, what are the properties of galaxies in the
green valley and the role of AGN in galaxy evolution?, and what are the
properties of radio-loud and radio-quiet quasars (QSO) and dichotomy between
the two?. Each of these questions has been developed under one specific project
that will be briefly introduced. These projects involve 6 PhD and 3 MSc
students and collaborations between Ethiopia, Rwanda, South Africa, Uganda,
Tanzania, Spain, Italy, and Chile. With all projects we aim: first, to
contribute to our general knowledge about AGN, and second, to contribute to the
development in astronomy and science in Ethiopia and East-Africa.",arxiv,Astronomy,2020,"Ethiopia, Rwanda, South Africa, Uganda, Tanzania, Spain, Italy, Chile"
10,10,Social and Economic Impact Analysis of Solar Mini-Grids in Rural Africa: A Cohort Study from Kenya and Nigeria,"Amy Town Carabajal, Akoua Orsot, Marie Pelagie Elimbi Moudio, Tracy Haggai, Chioma Joy Okonkwo, George Truett Jarrard III, Nicholas Stearns Selby",2024-01-01,http://arxiv.org/pdf/2401.02445v2,"This study presents the first comprehensive analysis of the social and
economic effects of solar mini-grids in rural African settings, specifically in
Kenya and Nigeria. A group of 2,658 household heads and business owners
connected to mini-grids over the last five years were interviewed both before
and one year after their connection. These interviews focused on changes in
gender equality, productivity, health, safety, and economic activity. The
results show notable improvements in all areas. Economic activities and
productivity increased significantly among the connected households and
businesses. The median income of rural Kenyan community members quadrupled.
Gender equality also improved, with women gaining more opportunities in
decision making and business. Health and safety enhancements were linked to
reduced use of hazardous energy sources like kerosene lamps. The introduction
of solar mini-grids not only transformed the energy landscape but also led to
broad socioeconomic benefits in these rural areas. The research highlights the
substantial impact of decentralized renewable energy on the social and economic
development of rural African communities. Its findings are crucial for
policymakers, development agencies, and stakeholders focused on promoting
sustainable energy and development in Africa.",arxiv,Environmental Science,2024,"Kenya, Nigeria"
11,11,Democratizing AI in Africa: FL for Low-Resource Edge Devices,"Jorge Fabila, Víctor M. Campello, Carlos Martín-Isla, Johnes Obungoloch, Kinyera Leo, Amodoi Ronald, Karim Lekadir",2024-08-30,http://arxiv.org/pdf/2408.17216v1,"Africa faces significant challenges in healthcare delivery due to limited
infrastructure and access to advanced medical technologies. This study explores
the use of federated learning to overcome these barriers, focusing on perinatal
health. We trained a fetal plane classifier using perinatal data from five
African countries: Algeria, Ghana, Egypt, Malawi, and Uganda, along with data
from Spanish hospitals. To incorporate the lack of computational resources in
the analysis, we considered a heterogeneous set of devices, including a
Raspberry Pi and several laptops, for model training. We demonstrate
comparative performance between a centralized and a federated model, despite
the compute limitations, and a significant improvement in model
generalizability when compared to models trained only locally. These results
show the potential for a future implementation at a large scale of a federated
learning platform to bridge the accessibility gap and improve model
generalizability with very little requirements.",arxiv,Computer Science,2024,"Algeria, Ghana, Egypt, Malawi, Uganda, Spain"
12,12,Cross-correlation between the thermal Sunyaev-Zeldovich effect and the Integrated Sachs-Wolfe effect,"Ayodeji Ibitoye, Wei-Ming Dai, Yin-Zhe Ma, Patricio Vielva, Denis Tramonte, Amare Abebe, Aroonkumar Beesham, Xuelei Chen",2023-10-27,http://arxiv.org/pdf/2310.18478v2,"We present a joint cosmological analysis of the power spectra measurement of
the Planck Compton parameter and the integrated Sachs-Wolfe (ISW) maps. We
detect the statistical correlation between the Planck Thermal Sunyaev-Zeldovich
(tSZ) map and ISW data with a significance of a $3.6\sigma$ confidence
level~(CL), with the autocorrelation of the Planck tSZ data being measured at a
$25 \sigma$ CL. The joint auto- and cross-power spectra constrain the matter
density to be $\Omega_{\rm m}= 0.317^{+0.040}_{-0.031}$, the Hubble constant
$H_{0}=66.5^{+2.0}_{-1.9}\,{\rm km}\,{\rm s}^{-1}\,{\rm Mpc}^{-1}$ and the rms
matter density fluctuations to be $\sigma_{8}=0.730^{+0.040}_{-0.037}$ at the
68% CL. The derived large-scale structure $S_{8}$ parameter is $S_8 \equiv
\sigma_{8}(\Omega_{\rm m}/0.3)^{0.5} = 0.755\pm{0.060} $. If using only the
diagonal blocks of covariance matrices, the Hubble constant becomes
$H_{0}=69.7^{+2.0}_{-1.5}\,{\rm km}\,{\rm s}^{-1}\,{\rm Mpc}^{-1}$. In
addition, we obtain the constraint of the product of the gas bias, gas
temperature, and density as $b_{\rm gas} \left(T_{\rm e}/(0.1\,{\rm keV})
\right ) \left(\bar{n}_{\rm e}/1\,{\rm m}^{-3} \right) =
3.09^{+0.320}_{-0.380}$. We find that this constraint leads to an estimate on
the electron temperature today as $T_{\rm e}=(2.40^{+0.250}_{-0.300}) \times
10^{6} \,{\rm K}$, consistent with the expected temperature of the warm-hot
intergalactic medium. Our studies show that the ISW-tSZ cross-correlation is
capable of probing the properties of the large-scale diffuse gas.",arxiv,Astrophysics,2023,No country names are mentioned in the abstract.
13,13,The stochastic nature of power-grid frequency in South Africa,"Leonardo Rydin Gorjão, Jacques Maritz",2022-11-10,http://arxiv.org/pdf/2211.05582v1,"In this work, we explore two mechanisms that explain non-Gaussian behaviour
of power-grid frequency recordings in the South African grid. We make use of a
Fokker-Planck approach to power-grid frequency that yields a direct relation
between common model parameters such as inertia, damping, and noise amplitude
and non-parametric estimations of the same directly from power-grid frequency
recordings. We propose two explanations for the non-Gaussian leptokurtic
distributions in South Africa: The first based on multiplicative noise in
power-grid frequency recordings, which we observe in South Africa; The second
based on the well-known scheduled and unscheduled load shedding and rolling
blackouts that beset South Africa. For the first we derive an analytic
expression of the effects of multiplicative noise that permits the estimation
of all statistical moments - and discuss drawbacks in comparison with the data;
For the second we employ a simple numerical analysis with a modular power grid
of South Africa. Both options help understand the statistics of power-grid
frequency in South Africa - particularly the presence of heavy tails.",arxiv,Electrical Engineering,2022,South Africa
14,14,Filling the uv-gaps of the current VLBI network in Africa,"Marcellin Atemkeng, Patrice M. Okouma, Eric Maina, Roger Ianjamasimanana, Serges Zambou",2020-03-19,http://arxiv.org/pdf/2003.08642v1,"In the African continent, South Africa has world-class astronomical
facilities for advanced radio astronomy research. With the advent of the Square
Kilometre Array project in South Africa (SA SKA), six countries in Africa (SA
SKA partner countries) have joined South Africa to contribute towards the
African Very Long Baseline Interferometry (VLBI) Networks (AVN). Each of the
AVN countries will soon have a single-dish radio telescope that will be part of
the AVN, the European VLBI Network, and the global VLBI network. The SKA and
the AVN will enable very high sensitivity VLBI in the southern hemisphere. In
the current AVN network, there is a gap in coverage in the central African
region. This work analyses the scientific impact if new antennas were to be
built or old telecommunication facilities were to be converted to radio
telescopes in each of the six countries in central Africa i.e. Cameroon, Gabon,
Congo, Equatorial Guinea, Chad, Central African Republic. The work also
discusses some economical and skills transfer impacts of having a radio
interferometer in this area of Africa.",arxiv,Astronomy,2020,"South Africa, Cameroon, Gabon, Congo, Equatorial Guinea, Chad, Central African Republic"
15,15,Amplify Initiative: Building A Localized Data Platform for Globalized AI,"Qazi Mamunur Rashid, Erin van Liemt, Tiffany Shih, Amber Ebinama, Karla Barrios Ramos, Madhurima Maji, Aishwarya Verma, Charu Kalia, Jamila Smith-Loud, Joyce Nakatumba-Nabende, Rehema Baguma, Andrew Katumba, Chodrine Mutebi, Jagen Marvin, Eric Peter Wairagala, Mugizi Bruce, Peter Oketta, Lawrence Nderu, Obichi Obiajunwa, Abigail Oppong, Michael Zimba, Data Authors",2025-04-18,http://arxiv.org/pdf/2504.14105v1,"Current AI models often fail to account for local context and language, given
the predominance of English and Western internet content in their training
data. This hinders the global relevance, usefulness, and safety of these models
as they gain more users around the globe. Amplify Initiative, a data platform
and methodology, leverages expert communities to collect diverse, high-quality
data to address the limitations of these models. The platform is designed to
enable co-creation of datasets, provide access to high-quality multilingual
datasets, and offer recognition to data authors. This paper presents the
approach to co-creating datasets with domain experts (e.g., health workers,
teachers) through a pilot conducted in Sub-Saharan Africa (Ghana, Kenya,
Malawi, Nigeria, and Uganda). In partnership with local researchers situated in
these countries, the pilot demonstrated an end-to-end approach to co-creating
data with 155 experts in sensitive domains (e.g., physicians, bankers,
anthropologists, human and civil rights advocates). This approach, implemented
with an Android app, resulted in an annotated dataset of 8,091 adversarial
queries in seven languages (e.g., Luganda, Swahili, Chichewa), capturing
nuanced and contextual information related to key themes such as misinformation
and public interest topics. This dataset in turn can be used to evaluate models
for their safety and cultural relevance within the context of these languages.",arxiv,Computer Science,2025,"Ghana, Kenya, Malawi, Nigeria, Uganda"
16,16,Impact of large scale climate oscillation on drought in West Africa,"Samuel T. Ogunjo, Ibiyinka A. Fuwape, Christiana F. Olusegun",2019-01-29,http://arxiv.org/pdf/1901.10145v1,"Drought poses a significant threat to the delicate economies in subsaharan
Africa. This study investigates the influence of large scale ocean oscillation
on drought in West Africa. Standardized Precipitation Index for the region was
computed using monthly precipitation data from the Climate Research Unit during
the period 1961 -1990. The impact of three ocean oscillation indices - Southern
Ocean Index (SOI), Pacific Decadal Oscillation (PDO) and North Atlantic
Oscillation (NAO) on drought over West Africa was investigated using linear
correlation, co-integration test, mutual information and nonlinear
synchronization methods. SOI showed predominantly positive correlation with
drought over the region while PDO and NAO showed negative correlation. This was
confirmed by the co-integration tests. The nonlinear test revealed more complex
relationship between the indices and drought. PDO has lesser influence or
contribute less to the drought in the coastal region compared to the Sahel
region of West Africa.",arxiv,Environmental Science,2019,Africa
17,17,Content and Quality Analysis of Parent-Facing Applications for Feeding Children with Autism Spectrum Disorder,"Christopher Cofie Kuzagbe, Fabrice Mukarage, Skye Nandi Adams, N'guessan Yves-Roland Douha, Edith Talina Luhanga",2025-05-02,http://arxiv.org/pdf/2505.01520v1,"Approximately 1 in 100 children worldwide are diagnosed with Autism Spectrum
Disorder (ASD), and 46% to 89% experience significant feeding difficulties.
Although mobile health (mHealth) applications offer potential support for
caregivers, the quality and relevance of apps targeting autism-related feeding
issues remain unclear. This systematic review evaluated mobile applications
available on the Apple App Store and the Google Play Store between September
and October 2024. The searches were carried out using 15 predefined terms
(e.g., ""child autism feeding"", ""child autism food""). Applications were eligible
if they were in English, free to download, updated within the past year,
explicitly addressed feeding in children with autism, accessible in Africa, and
had more than 100 downloads. Of the 326 apps identified, only two iOS
applications met all inclusion criteria; no Android apps qualified. Behavior
Change Wheel (BCW) analysis showed that the selected applications incorporated
multiple intervention functions, such as education, training, enablement,
incentivization, and modeling, though none addressed the full spectrum of
behavioral strategies. Mobile App Rating Scale (MARS) indicated moderate to
high usability, with features such as sensory-friendly food routines and
structured caregiver tools. However, both apps lacked clinical validation and
comprehensive customization. These findings highlight a critical gap in the
availability of evidence-based high-quality mHealth tools for caregivers
managing ASD-related feeding challenges and underscore the need for
professionally developed and culturally sensitive digital solutions.",arxiv,Psychology,2025,Africa
