,Unnamed: 0,Title,Author,Publication_Year,Link,Abstract,Repository,Topic_Category,Year,Country(s)
175,175,Sign-to-Speech Model for Sign Language Understanding: A Case Study of Nigerian Sign Language,"Steven Kolawole, Opeyemi Osakuade, Nayan Saxena, Babatunde Kazeem Olorisade",2021-11-01,http://arxiv.org/pdf/2111.00995v2,"Through this paper, we seek to reduce the communication barrier between the
hearing-impaired community and the larger society who are usually not familiar
with sign language in the sub-Saharan region of Africa with the largest
occurrences of hearing disability cases, while using Nigeria as a case study.
The dataset is a pioneer dataset for the Nigerian Sign Language and was created
in collaboration with relevant stakeholders. We pre-processed the data in
readiness for two different object detection models and a classification model
and employed diverse evaluation metrics to gauge model performance on
sign-language to text conversion tasks. Finally, we convert the predicted sign
texts to speech and deploy the best performing model in a lightweight
application that works in real-time and achieves impressive results converting
sign words/phrases to text and subsequently, into speech.",arxiv,Linguistics,2021,Nigeria
176,176,A labeled Clinical-MRI dataset of Nigerian brains,"Eberechi Wogu, Patrick Filima, Bradley Caron, Daniel Levitas, Peer Herholz, Catherine Leal, Mohammed F. Mehboob, Soichi Hayashi, Simisola Akintoye, George Ogoh, Tawe Godwin, Damian Eke, Franco Pestilli",2023-11-08,http://arxiv.org/pdf/2311.04425v1,"We describe a Magnetic Resonance Imaging (MRI) dataset from individuals from
the African nation of Nigeria. The dataset contains pseudonymized structural
MRI (T1w, T2w, FLAIR) data of clinical quality. The dataset contains data from
36 images from healthy control subjects, 32 images from individuals diagnosed
with age-related dementia and 20 from individuals with Parkinson's disease.
There is currently a paucity of data from the African continent. Given the
potential for Africa to contribute to the global neuroscience community, this
first MRI dataset represents both an opportunity and benchmark for future
studies to share data from the African continent.",arxiv,Medical Imaging,2023,Nigeria
177,177,Low-Resource Neural Machine Translation Using Recurrent Neural Networks and Transfer Learning: A Case Study on English-to-Igbo,"Ocheme Anthony Ekle, Biswarup Das",2025-04-24,http://arxiv.org/pdf/2504.17252v1,"In this study, we develop Neural Machine Translation (NMT) and
Transformer-based transfer learning models for English-to-Igbo translation - a
low-resource African language spoken by over 40 million people across Nigeria
and West Africa. Our models are trained on a curated and benchmarked dataset
compiled from Bible corpora, local news, Wikipedia articles, and Common Crawl,
all verified by native language experts. We leverage Recurrent Neural Network
(RNN) architectures, including Long Short-Term Memory (LSTM) and Gated
Recurrent Units (GRU), enhanced with attention mechanisms to improve
translation accuracy. To further enhance performance, we apply transfer
learning using MarianNMT pre-trained models within the SimpleTransformers
framework. Our RNN-based system achieves competitive results, closely matching
existing English-Igbo benchmarks. With transfer learning, we observe a
performance gain of +4.83 BLEU points, reaching an estimated translation
accuracy of 70%. These findings highlight the effectiveness of combining RNNs
with transfer learning to address the performance gap in low-resource language
translation tasks.",arxiv,Computer Science,2025,Nigeria
178,178,Two bounds on the noncommuting graph,"Stefano Nardulli, Francesco G. Russo",2015-02-04,http://arxiv.org/pdf/1502.01287v1,"Erd\H{o}s introduced the noncommuting graph, in order to study the number of
commuting elements in a finite group. Despite the use of combinatorial ideas,
his methods involved several techniques of classical analysis. The interest for
this graph is becoming relevant in the last years for various reasons. Here we
deal with a numerical aspect, showing for the first time an isoperimetric
inequality and an analytic condition in terms of Sobolev inequalities. This
last result holds in the more general context of weighted locally finite
graphs.",arxiv,Mathematics,2015,"Erd\H{o}s is a Hungarian surname, but the abstract does not explicitly mention any country. Therefore, no country name is mentioned in the abstract."
179,179,Large trilinear $A_t$ soft supersymmetry breaking coupling from 5D MSSM,"Ammar Abdalgabar, Alan S. Cornell",2015-06-06,http://arxiv.org/pdf/1506.02138v1,"The possibility of generating a large trilinear $A_t$ soft supersymmetry
breaking coupling at low energies through renormalisation group evolution in
the 5D MSSM is investigated. Using the power law running in five dimensions and
a compactification scale in the 10-$10^3$ TeV range, to show that gluino mass
may drive a large enough $A_t$ to reproduce the measured Higgs mass and have a
light stop superpartner below $\sim 1$ TeV as preferred by the fine tuning
argument for the Higgs mass.",arxiv,Physics,2015,No country is mentioned in the abstract.
180,180,SHA-1 and the Strict Avalanche Criterion,"Yusuf Motara, Barry Irwin",2016-09-02,http://arxiv.org/pdf/1609.00616v1,"The Strict Avalanche Criterion (SAC) is a measure of both confusion and
diffusion, which are key properties of a cryptographic hash function. This work
provides a working definition of the SAC, describes an experimental methodology
that can be used to statistically evaluate whether a cryptographic hash meets
the SAC, and uses this to investigate the degree to which compression function
of the SHA-1 hash meets the SAC. The results ($P < 0.01$) are heartening: SHA-1
closely tracks the SAC after the first 24 rounds, and demonstrates excellent
properties of confusion and diffusion throughout.",arxiv,Computer Science,2016,No country is mentioned in the abstract.
181,181,First observation of a reactor-status effect on the beta+ decay rate of 22Na,"Robert de Meijer, Albert Zondervan, Jan Stegenga, Steph Steyn, Robbie Lindsay, Milton van Rooy, Marco Tijs, Han Limburg",2016-10-05,http://arxiv.org/pdf/1610.01332v2,"In the search for an electron antineutrino detection method with sensitivity
below the 1.8 MeV threshold for the inverse beta decay reaction, beta decay
counting experiments with ca. 3 kBq 22Na and 60Co sources were conducted at
unit #1 (2.775 GW_th) of the Koeberg Nuclear Power Station in South Africa. The
setup consisted of one NaI crystal to measure de-excitation and annihilation
photons associated with beta decay. Its volume and well shape were chosen to
use coincidence summing in order to differentiate between electron capture and
beta+ emission in 22Na. The setup was shielded from the reactor core by 8 m of
uninterrupted concrete. Background radiation, responsible for ca. 1% of the
total countrate with either source, increased by merely 3% when the reactor
status changed from OFF to ON. Normalized countrates of three energy
regions-of-interest (TOT, MED, HI) were parameterized to jointly describe the
time dependence of two instrumental effects and a reactor-status step function
in a least-squares regression analysis. With the 22Na source, the fractional
countrate changes in the step from reactor OFF to ON were: (delA/A)_TOT =
[-3.02 +- 0.14(stat) +- 0.07(syst)] x 10^-4, (delA/A)_MED = [+1.44 +-
0.42(stat) +- 0.07(syst)] x 10^-4, and (delA/A)_HI = [-2.70 +- 0.26(stat) +-
0.04(syst)] x 10^-4. The uncertainty budget is incomplete because it does not
contain the possible influence from environmental factors and the finite
stability of the MCA clock-oscillator. No reactor-status dependence was
observed with the 60Co source. The corresponding cross sections are [1.55 +-
0.07(stat)] x 10^-25 cm^2 for EC + beta+ decay in 22Na and [0.5 +- 1.5(stat)] x
10^-26 cm^2 for beta- decay of 60Co. The negative sign for TOT and HI activity
changes in 22Na points to an antineutrino related interference effect on the
beta+ decay of 22Na and rules out reactor neutron induced reactions.",arxiv,Physics,2016,South Africa
182,182,Holography at QCD-$T_{\rm c}$,"Rico Zöllner, Burkhard Kampfer",2017-03-08,http://arxiv.org/pdf/1703.02958v1,"Within an extended soft wall model, we study the temperature dependence of
the lowest vector meson states. Scales are adjusted by using as input the
$\rho$ meson mass in vacuum and the velocity of sound from lattice QCD which
displays a minimum at $T_{\rm c}$. The melting of the $\rho$ meson occurs at
temperatures $\mathcal{O}(T_{\rm c})$.",arxiv,Physics,2017,No country is mentioned in the abstract.
183,183,Sums and products of square-zero matrices,Christiaan J Hattingh,2018-04-06,http://arxiv.org/pdf/1804.02140v1,"Which matrices can be written as sums or products of square-zero matrices?
This question is the central premise of this dissertation. Over the past 25
years a significant body of research on products and linear combinations of
square-zero matrices has developed, and it is the aim of this study to present
this body of research in a consolidated, holistic format, that could serve as a
theoretical introduction to the subject. The content of the research is
presented in three parts: first results within the broader context of sums and
products of nilpotent matrices are discussed, then products of square-zero
matrices, and finally sums of square-zero matrices.",arxiv,Mathematics,2018,No country is mentioned in the abstract.
184,184,Formal Verification of a Geometry Algorithm: A Quest for Abstract Views and Symmetry in Coq Proofs,Yves Bertot,2018-09-03,http://arxiv.org/pdf/1809.00559v1,"This extended abstract is about an effort to build a formal description of a
triangulation algorithm starting with a naive description of the algorithm
where triangles, edges, and triangulations are simply given as sets and the
most complex notions are those of boundary and separating edges. When
performing proofs about this algorithm, questions of symmetry appear and this
exposition attempts to give an account of how these symmetries can be handled.
All this work relies on formal developments made with Coq and the mathematical
components library.",arxiv,Computer Science,2018,France
185,185,Fast Radio Burst Cosmology and HIRAX,"Amanda Weltman, Anthony Walters",2019-05-17,http://arxiv.org/pdf/1905.07132v1,"Until very recently we had as many theories to explain Fast Radio Bursts as
we have observations of them. An explosion of data is coming, if not here
already, and thus it is an opportune time to understand how we can use FRBs for
cosmology. The HIRAX experiment, based mostly in South Africa, will be one such
experiment, designed not only to observe large numbers of FRBs but also to
localise them. In this short article we consider briefly, some ways in which
HIRAX can change the landscape of FRB cosmology.",arxiv,Astrophysics,2019,South Africa
186,186,Radio transients investigation with VLBI,"K. V. Sokolovsky, M. Giroletti, S. Corbel, G. E. Anderson, B. W. Stappers",2018-03-07,http://arxiv.org/pdf/1803.02831v1,"The technique of Very Long Baseline Interferometry (VLBI) can provide
accurate localization and unique physical information about radio transients.
However, it is still underutilized due to the inherent difficulties of VLBI
data analysis and practical difficulties of organizing observations on short
notice. We present a brief overview of the currently available VLBI arrays and
observing strategies used to study long- and short-duration radio transients.",arxiv,Astronomy,2018,No country is mentioned in the abstract.
187,187,Network analysis regarding international trade network,"Xiufeng Yan, Qi Tang",2021-11-04,http://arxiv.org/pdf/2111.02633v1,"We study the effect of globalization of world economy between 1980 and 2010
by using network analysis technics on trade and GDP data of 71 countries in the
world. We draw results distinguishing relatively developing and relatively
developed countries during this period of time and point out the standing out
economies among the BRICS countries during the years of globalization: within
our context of study, China and Russia are the countries that already exhibit
developed economy characters, India is next in line but have some unusual
features, while Brazil and South Africa still have erratic behaviors",arxiv,Economics,2021,"China, Russia, India, Brazil, South Africa"
188,188,From Omicron to Its BA.5 Subvariant: A New Twist in Coronavirus Contagiousness Evolution,J. C. Phillips,2022-08-09,http://arxiv.org/pdf/2208.04956v1,"In 2022 new subvariants of Coronavirus appeared in South Africa, and spread
rapidly to other parts of the world. The effects of selective evolution on
increasing the already high contagiousness of CoV19 up to Omicron were
previously discussed with high accuracy using concepts new to molecular biology
(from mathematics and physics) that have been developed over the last few
decades. Here we discuss the new subvariants, and find novel features
successfully combining both improved flexibility and improved stability.",arxiv,Virology,2022,South Africa
189,189,Non-static hyperbolicallly symmetric fluids,L. Herrera,2022-08-23,http://arxiv.org/pdf/2208.10986v1,"We present the general properties of dynamic dissipative fluid distribution
endowed with hyperbolical symmetry. All the equations required for its analysis
are exhibited and used to contrast the behavior of the system with the
spherically symmetric case. Several exact solutions are exhibited and
prospective applications to astrophysical and cosmological scenarios are
discussed.",arxiv,Physics,2022,No country names are mentioned in the abstract.
190,190,The 'Problematic Paper Screener' automatically selects suspect publications for post-publication (re)assessment,"Guillaume Cabanac, Cyril Labbé, Alexander Magazinov",2022-10-07,http://arxiv.org/pdf/2210.04895v1,"Post publication assessment remains necessary to check erroneous or
fraudulent scientific publications. We present an online platform, the
'Problematic Paper Screener'
(https://www.irit.fr/~Guillaume.Cabanac/problematic-paper-screener) that
leverages both automatic machine detection and human assessment to identify and
flag already published problematic articles. We provide a new effective tool to
curate the scientific literature.",arxiv,Library and Information Science,2022,No country is mentioned in the abstract.
191,191,The proton radius and its relatives -- much ado about nothing?,Ulf-G. Meißner,2022-11-10,http://arxiv.org/pdf/2211.05419v1,"I summarize the dispersion-theoretical analysis of the nucleon
electromagnetic form factors. Special emphasis is given on the extraction of
the proton charge radius and its relatives, the proton magnetic radius as well
as the neutron magnetic radius. Some recent work on the hyperfine splitting in
leptonic hydrogen and on radiative corrections to muon-proton scattering is
also discussed. Some views on future studies are given.",arxiv,Physics,2022,No country is mentioned in the abstract.
192,192,Open-quantum-systems approach to in-medium heavy quarkonium dynamics,Alexander Rothkopf,2022-11-19,http://arxiv.org/pdf/2211.10676v1,"Heavy quarkonium continues to play a central role in the study of nuclear
matter under extremes of temperature and density in relativistic heavy-ion
collisions. In this talk I report on recent developments in the theoretical
description of quarkonium in-medium dynamics using the open-quantum systems
approach. Not only does it provide a clear interpretation of the imaginary part
of the complex heavy-quark potential but also reveals that a subtle interplay
between screening and wavefunction decoherence is responsible for the melting
of heavy quarkonium states.",arxiv,Physics,2022,No country is mentioned in the abstract.
193,193,Production of muons from heavy-flavour hadron decays in heavy-ion collisions with ALICE at the LHC,Bharati Naik,2022-11-24,http://arxiv.org/pdf/2211.13664v1,"Measurements of the production of muons from heavy-flavour hadron decays at
forward rapidity ($2.5 < y < 4.0$) in Pb--Pb collisions at $\sqrt{s_{\rm NN}} =
2.76$ and 5.02 TeV with the ALICE detector are presented along with the $R_{\rm
AA}$ measurements in different centrality intervals as a function of transverse
momentum, $p_{\rm T}$. Results of the measured $R_{\rm AA}$ at both energies
are shown and are compared to the different model predictions.",arxiv,Physics,2022,Switzerland
194,194,Towards microscopic optical potentials in deformed nuclei,"Andrea Idini, Jimmy Rotureau, Johan Boström, Jimmy Ljungberg, B. Gillis Carlsson",2022-11-25,http://arxiv.org/pdf/2211.14263v1,"A microscopic and consistent description of both nuclear structure and
reactions is instrumental to extend the predictivity of models calculating
scattering observables. In particular, this is crucial in the case of exotic
nuclei not yet discovered.
  In this manuscript, we will present the plan of the Lund effort for a
symmetry breaking description of bound and scattering observables using a
generator coordinate method model based on an effective Hamiltonian constrained
with a (Skyrme) functional. Following this, we will illustrate the steps to
construct an optical potential for deformed nuclei from microscopic
wavefunctions obtained with projected generator coordinate method from
Hartree-Fock-Bogoliubov basis.",arxiv,Nuclear Physics,2022,Sweden
195,195,Lee-Yang-inspired functional including contributions to fourth order in effective field theory,Jérémy Bonnard,2022-11-29,http://arxiv.org/pdf/2211.16447v1,"In the last years, a new family of energy density functionals directly
inspired by effective field theory (EFT) has been developed, among which the
ELYO (extended Lee-Yang Orsay) functional. In this paper, a new extension of
ELYO that includes the recently calculated fourth-order EFT terms is presented.
Compared to the previous version, the description of neutron-drop energies
slightly degrades for a harmonic trap $\hbar\omega =10$ MeV -- yet remaining
reasonable -- , but improves for $\hbar\omega =5$ MeV. Furthermore, the
obtained neutron effective mass agrees significantly better with
\textit{ab-initio} estimates.",arxiv,Physics,2022,Orsay
196,196,Liquid Scintillators; Technology and Challenges,Milind Vaman Diwan,2024-08-03,http://arxiv.org/pdf/2408.01820v1,"This is a brief review of liquid scintillators, an important technology for
detection of ionizing radiation. We will first review the basic mechanisms of
light production in most organic liquid scintillators. For most practical
detector applications, the scintillators need to be optimized for choices of
photosensors and compatibility with optical windows. A summary of important
past experimental projects with liquid scintillators is provided. We will
complete the review with a list of modern practices, particularly of metal
doping, and development of water based hybrid materials that allow simultaneous
detection of Cherenkov and scintillation light.",arxiv,Physics,2024,No country is mentioned in the abstract.
197,197,A discrete-time survival model to handle interval-censored covariates,"Avi Kenny, Stephen Olivier, James P. Hughes, Mark J. Siedner",2024-08-14,http://arxiv.org/pdf/2408.07738v1,"Methods are lacking to handle the problem of survival analysis in the
presence of an interval-censored covariate, specifically the case in which the
conditional hazard of the primary event of interest depends on the occurrence
of a secondary event, the observation time of which is subject to interval
censoring. We propose and study a flexible class of discrete-time parametric
survival models that handle the censoring problem through joint modeling of the
interval-censored secondary event, the outcome, and the censoring mechanism. We
apply this model to the research question that motivated the methodology,
estimating the effect of HIV status on all-cause mortality in a prospective
cohort study in South Africa.",arxiv,Statistics,2024,South Africa
198,198,Levelized Cost of Energy for PV and Grid Scale Energy Storage Systems,"Chun Sing Lai, Malcolm D McCulloch",2016-09-20,http://arxiv.org/pdf/1609.06000v1,"With the increasing penetration of renewable energy sources and energy
storage devices in the power system, it is important to evaluate the cost of
the system by using Levelized Cost of Energy (LCOE). In this paper a new
metric, Levelized Cost of Delivery (LCOD) is proposed to calculate the LCOE for
the energy storage. The recent definitions in LCOE for renewable energy system
has been reviewed. From fundamental principles, it is demonstrated that there
is a need to introduce a new method to evaluate LCOE of the system as the
conventional LCOE is not applicable for renewable energy storage systems. Three
years of solar irradiance data in Africa collected from Johannesburg and the
national load data from Kenya are obtained for case studies. The proposed cost
calculation methods are evaluated for two types of storage technologies
(Vanadium Redox Battery (VRB) and Lithium-ion) with real-life data. It shows
that the marginal LCOE and LCOD indices can be used to assist policymakers to
consider the discount rate and the type of storage technology for a cost
effective renewable storage energy system.",arxiv,Energy Economics,2016,"Africa, Kenya"
199,199,A Geostatistical Framework for Combining Spatially Referenced Disease Prevalence Data from Multiple Diagnostics,"Benjamin Amoah, Emanuele Giorgi, Peter Diggle",2018-08-09,http://arxiv.org/pdf/1808.03141v1,"Multiple diagnostic tests are often used due to limited resources or because
they provide complementary information on the epidemiology of a disease under
investigation. Existing statistical methods to combine prevalence data from
multiple diagnostics ignore the potential over-dispersion induced by the
spatial correlations in the data. To address this issue, we develop a
geostatistical framework that allows for joint modelling of data from multiple
diagnostics by considering two main classes of inferential problems: (1) to
predict prevalence for a gold-standard diagnostic using low-cost and
potentially biased alternative tests; (2) to carry out joint prediction of
prevalence from multiple tests. We apply the proposed framework to two case
studies: mapping Loa loa prevalence in Central and West Africa, using
miscroscopy and a questionnaire-based test called RAPLOA; mapping Plasmodium
falciparum malaria prevalence in the highlands of Western Kenya using
polymerase chain reaction and a rapid diagnostic test. We also develop a Monte
Carlo procedure based on the variogram in order to identify parsimonious
geostatistical models that are compatible with the data. Our study highlights
(i) the importance of accounting for diagnostic-specific residual spatial
variation and (ii) the benefits accrued from joint geostatistical modelling so
as to deliver more reliable and precise inferences on disease prevalence.",arxiv,Epidemiology,2018,"Central and West Africa, Kenya"
200,200,IS-COUNT: Large-scale Object Counting from Satellite Images with Covariate-based Importance Sampling,"Chenlin Meng, Enci Liu, Willie Neiswanger, Jiaming Song, Marshall Burke, David Lobell, Stefano Ermon",2021-12-16,http://arxiv.org/pdf/2112.09126v1,"Object detection in high-resolution satellite imagery is emerging as a
scalable alternative to on-the-ground survey data collection in many
environmental and socioeconomic monitoring applications. However, performing
object detection over large geographies can still be prohibitively expensive
due to the high cost of purchasing imagery and compute. Inspired by traditional
survey data collection strategies, we propose an approach to estimate object
count statistics over large geographies through sampling. Given a cost budget,
our method selects a small number of representative areas by sampling from a
learnable proposal distribution. Using importance sampling, we are able to
accurately estimate object counts after processing only a small fraction of the
images compared to an exhaustive approach. We show empirically that the
proposed framework achieves strong performance on estimating the number of
buildings in the United States and Africa, cars in Kenya, brick kilns in
Bangladesh, and swimming pools in the U.S., while requiring as few as 0.01% of
satellite images compared to an exhaustive approach.",arxiv,Computer Vision,2021,"United States, Africa, Kenya, Bangladesh"
