,Unnamed: 0,Title,Author,Publication_Year,Link,Abstract,Repository,Topic_Category,Year,Country(s)
72,72,The radiation environment over the African continent at aviation altitudes: First results of the RPiRENA-based dosimeter,"M. G. Mosotho, R. D. Strauss, S. Bottcher, C. Diedericks",2023-03-04,http://arxiv.org/pdf/2303.15452v1,"The radiation environment over the African continent, at aviation altitudes,
remains mostly uncharacterized and unregulated. In this paper we present
initial measurements made by a newly developed active dosimeter on-board
long-haul flights between South Africa and Germany. Based on these initial
tests, we believe that this low-cost and open-source dosimeter is suitable for
continued operation over the Africa continent and can provide valuable
long-term measurements to test dosimteric models and inform aviation policy",arxiv,Physics,2023,"South Africa, Germany"
73,73,An Endangered National Heritage Site -- The Cape Observatory,Ian Glass,2024-01-24,http://arxiv.org/pdf/2401.13456v1,"The SAAO Cape Town campus was declared a National Heritage Site in December
2018, just short of its 200th anniversary, but is now in a run-down condition.
As the former Royal Observatory, it is the oldest scientific institution in
South Africa and probably in all Africa. It has a fascinating and
well-documented history and surely deserves better. For many years maintenance
has been neglected and many of the old telescopes and buildings are in a poor
state. They are beginning to show signs of serious decay. Some examples are
given.",arxiv,History,2024,South Africa
74,74,Supporting Contraceptive Decision-Making in the Intermediated Pharmacy Setting in Kenya,"Lisa Orii, Elizabeth K Harrington, Serah Gitome, Nelson Kiprotich Cheruiyot, Elizabeth Anne Bukusi, Sandy Cheng, Ariel Fu, Khushi Khandelwal, Shrimayee Narasimhan, Richard Anderson",2025-02-07,http://arxiv.org/pdf/2502.05323v1,"Adolescent girls and young women (AGYW) in sub-Saharan Africa face unique
barriers to contraceptive access and lack AGYW-centered contraceptive
decision-support resources. To empower AGYW to make informed choices and
improve reproductive health outcomes, we developed a tablet-based application
to provide contraceptive education and decision-making support in the pharmacy
setting - a key source of contraceptive services for AGYW - in Kenya. We
conducted workshops with AGYW and pharmacy providers in Kenya to gather app
feedback and understand how to integrate the intervention into the pharmacy
setting. Our analysis highlights how intermediated interactions - a multiuser,
cooperative effort to enable technology use and information access - could
inform a successful contraceptive intervention in Kenya. The potential
strengths of intermediation in our setting inform implications for
technological health interventions in intermediated scenarios in
\lrem{LMICs}\ladd{low- and middle-income countries}, including challenges and
opportunities for extending impact to different populations and integrating
technology into resource-constrained healthcare settings.",arxiv,Public Health,2025,Kenya
75,75,ICT and Health System Performance in Africa: A Multi-Method Approach,"Felix Olu Bankole, Lucas Mimbi",2016-05-04,http://arxiv.org/pdf/1605.01151v1,"For the past two decades, the discussion regarding the effect of ICT on
health systems is becoming apparent. However, past studies have mainly focused
on ICT impact on specific social-economic phenomena. Little empirical research
on ICT and health systems exists. Many African countries have invested in ICT
and there is a need to examine if such investments have impacted on health
system of these countries. Using a multi-method approach, data for 27 African
countries were analysed. We employed Data Envelopment Analysis, Cluster
Analysis and Partial Least Squares to examine the impact. The findings indicate
that the 27 countries can be grouped into three clusters based on their
relative efficiency scores of ICT and health systems. More compelling, the
findings indicate that countries that performed efficiently in ICT inputs also
do so in their health systems. Further, findings indicate that ICT
significantly improves life expectancy at birth and reduces infant mortality
rate. African countries must significantly invest in ICT to improve their
health systems so as to achieve socio-economic development. The current study
has theoretical, methodological and policy implications.",arxiv,Health Informatics,2016,African countries
76,76,Special Issue on Advances in Chiral Quark Models,Jorge Segovia,2022-03-09,http://arxiv.org/pdf/2203.04778v1,"The number of exotic candidates in both light- and heavy-quark hadron sectors
has increased dramatically since the discovery by the Belle Collaboration of
the so-called $X(3872)$ in 2003. It is clear that the simple quark model
picture needs an extension and thus the last twenty years have witnessed an
explosion of related theoretical and experimental activity. The ultimate goal
of theory is to describe the properties of exotic states from the first
principles of Quantum Chromodynamics (QCD), which is the non-Abelian Quantum
Field Theory that describes the strong interaction. However, since this task is
quite challenging, a more modest goal to start with is the development of
QCD-motivated phenomenological models that specify the colored constituents,
how they are clustered, and the forces between them. This Special Issue invited
contributions reporting recent advances of phenomenological quark models in the
study of hadron's spectrocopy, structure, and interactions, paying special
attention to the exotic candidates but without losing sight of the conventional
states. In response to the call for papers, and after a comprehensive peer
review process, 8 articles qualified for acceptance in the final edition of the
Special Issue. The authors are from geographically distributed countries such
as Spain, South Africa, Ghana, China, Brazil, Argentina. This reflects the
impact of the proposed topic and the effective organization of the guest
editorial team of this Special Issue.",arxiv,Physics,2022,"Spain, South Africa, Ghana, China, Brazil, Argentina"
77,77,Can an AI Win Ghana's National Science and Maths Quiz? An AI Grand Challenge for Education,"George Boateng, Victor Kumbol, Elsie Effah Kaufmann",2023-01-30,http://arxiv.org/pdf/2301.13089v1,"There is a lack of enough qualified teachers across Africa which hampers
efforts to provide adequate learning support such as educational question
answering (EQA) to students. An AI system that can enable students to ask
questions via text or voice and get instant answers will make high-quality
education accessible. Despite advances in the field of AI, there exists no
robust benchmark or challenge to enable building such an (EQA) AI within the
African context. Ghana's National Science and Maths Quiz competition (NSMQ) is
the perfect competition to evaluate the potential of such an AI due to its wide
coverage of scientific fields, variety of question types, highly competitive
nature, and live, real-world format. The NSMQ is a Jeopardy-style annual live
quiz competition in which 3 teams of 2 students compete by answering questions
across biology, chemistry, physics, and math in 5 rounds over 5 progressive
stages until a winning team is crowned for that year. In this position paper,
we propose the NSMQ AI Grand Challenge, an AI Grand Challenge for Education
using Ghana's National Science and Maths Quiz competition (NSMQ) as a case
study. Our proposed grand challenge is to ""Build an AI to compete live in
Ghana's National Science and Maths Quiz (NSMQ) competition and win - performing
better than the best contestants in all rounds and stages of the competition.""
We describe the competition, and key technical challenges to address along with
ideas from recent advances in machine learning that could be leveraged to solve
this challenge. This position paper is a first step towards conquering such a
challenge and importantly, making advances in AI for education in the African
context towards democratizing high-quality education across Africa.",arxiv,Education Technology,2023,Ghana
78,78,CyberMoraba: A game-based approach enhancing cybersecurity awareness,Mike Nkongolo,2024-03-15,http://arxiv.org/pdf/2403.10118v1,"Numerous studies confirm Cybersecurity Awareness Games (CAGs) effectively
bolster organisational security against cyberattacks. This article introduces a
serious CAG, integrating the traditional South African Morabaraba board game
into cybersecurity education. Players adopt roles of defenders or attackers,
strategically placing tokens to enhance awareness. Evaluation shows positive
outcomes, enhancing understanding and enjoyment among participants.",arxiv,Computer Science,2024,South Africa
79,79,A Highly Granular Temporary Migration Dataset Derived From Mobile Phone Data in Senegal,"Paul Blanchard, Stefania Rubrichi",2024-06-21,http://arxiv.org/pdf/2406.15216v1,"Understanding temporary migration is crucial for addressing various
socio-economic and environmental challenges in developing countries. However,
traditional surveys often fail to capture such movements effectively, leading
to a scarcity of reliable data, particularly in sub-Saharan Africa. This
article introduces a detailed and open-access dataset that leverages mobile
phone data to capture temporary migration in Senegal with unprecedented
spatio-temporal detail. The dataset provides measures of migration flows and
stock across 151 locations across the country and for each half-month period
from 2013 to 2015, with a specific focus on movements lasting between 20 and
180 days. The article presents a suite of methodological tools that not only
include algorithmic methods for the detection of temporary migration events in
digital traces, but also addresses key challenges in aggregating individual
trajectories into coherent migration statistics. These methodological
advancements are not only pivotal for the intrinsic value of the dataset but
also adaptable for generating systematic migration statistics from other
digital trace datasets in other contexts.",arxiv,Data Science,2024,Senegal
80,80,Globalizing Fairness Attributes in Machine Learning: A Case Study on Health in Africa,"Mercy Nyamewaa Asiedu, Awa Dieng, Abigail Oppong, Maria Nagawa, Sanmi Koyejo, Katherine Heller",2023-04-05,http://arxiv.org/pdf/2304.02190v1,"With growing machine learning (ML) applications in healthcare, there have
been calls for fairness in ML to understand and mitigate ethical concerns these
systems may pose. Fairness has implications for global health in Africa, which
already has inequitable power imbalances between the Global North and South.
This paper seeks to explore fairness for global health, with Africa as a case
study. We propose fairness attributes for consideration in the African context
and delineate where they may come into play in different ML-enabled medical
modalities. This work serves as a basis and call for action for furthering
research into fairness in global health.",arxiv,Computer Science,2023,Africa
81,81,A review of effects of climate change on Agriculture in Africa,"Samuel Asante Gyamerah, Dennis Ikpe",2021-08-25,http://arxiv.org/pdf/2108.12267v1,"Currently, agriculture in Africa contributes only a tenth to global Green
House Gas (GHG) emissions from agriculture. Despite its relatively low
contribution to GHG, a conundrum of ""climate justice"", adverse impacts of
climate change disproportionately threaten Africa's agriculture, the
Continent's main economic sector. Consequently, we seek to review the effects
of climate change on Agriculture.",arxiv,Environmental Science,2021,Africa
82,82,Status of the Computing for Research in Africa,Ghita Rahal,2022-06-09,http://arxiv.org/pdf/2206.05306v1,"In the framework of the African Strategy for Fundamental and Applied Physics
AFSAP, we have launched a survey to understand the need in computing of
research scientists in Africa. In this paper we summarise the survey and
extract possible guidelines and recommendations to improve the situation and
boost scientific research in Africa.",arxiv,Computer Science,2022,Africa
83,83,"Northwest Africa 5958: a weakly altered CM-related ungrouped chondrite, not a CI3","Emmanuel Jacquet, Jean-Alix Barrat, Pierre Beck, Florent Caste, Jérôme Gattacceca, Corinne Sonzogni, Matthieu Gounelle",2017-02-20,http://arxiv.org/pdf/1702.05955v1,"Northwest Africa (NWA) 5958 is a carbonaceous chondrite found in Morocco in
2009. Preliminary chemical and isotopic data leading to its initial
classification as C3.0 ungrouped have prompted us to conduct a multi-technique
study of this meteorite and present a general description here. The petrography
and chemistry of NWA 5958 is most similar to a CM chondrite, with a low degree
of aqueous alteration, apparently under oxidizing conditions, and evidence of a
second, limited alteration episode manifested by alteration fronts. The oxygen
isotopic composition, with $\Delta^{17}$O = -4.3 $\permil$, is more 16O-rich
than all CM chondrites, indicating, along with other compositional arguments, a
separate parent body of origin. We suggest that NWA 5958 be reclassified as an
ungrouped carbonaceous chondrite related to the CM group.",arxiv,Planetary Science,2017,Morocco
84,84,Analysing Scientific Mobility and Collaboration in the Middle East and North Africa,"Jamal El-Ouahi, Nicolas Robinson-Garcia, Rodrigo Costas",2020-09-16,http://arxiv.org/pdf/2009.07815v2,"This study investigates the scientific mobility and international
collaboration networks in the Middle East and North Africa (MENA) region
between 2008 and 2017. By using affiliation metadata available in scientific
publications, we analyse international scientific mobility flows and
collaboration linkages. Three complementary approaches allow us to obtain a
detailed characterization of scientific mobility. First, we uncover the main
destinations and origins of mobile scholars for each country. Results reveal
geographical, cultural and historical proximities. Cooperation programs also
contribute to explain some of the observed flows. Second, we use the academic
age. The average academic age of migrant scholars in MENA was about 12.4 years.
The academic age group 6-to-10 years is the most common for both emigrant and
immigrant scholars. Immigrants are relatively younger than emigrants, except
for Iran, Palestine, Lebanon, and Turkey. Scholars who migrated to Gulf
Cooperation Council countries, Jordan and Morocco were in average younger than
emigrants by 1.5 year from the same countries. Third, we analyse gender
differences. We observe a clear gender gap: Male scholars represent the largest
group of migrants in MENA. We conclude discussing the policy relevance of the
scientific mobility and collaboration aspects.",arxiv,Sociology,2020,"Iran, Palestine, Lebanon, Turkey, Jordan, Morocco"
85,85,Drivers of Mobile Payment Acceptance:The Impact of Network Externalities in Nigeria,"Qasim Ajao, Olukotun Oludamilare, Lanre Sadeeq",2023-05-24,http://arxiv.org/pdf/2305.15436v3,"The rising popularity of mobile payments can be attributed to the widespread
use of smartphones and their applications. Despite its potential to simplify
our lives, its adoption in African countries has been limited. This paper aims
to enhance our understanding of the critical factors that influence the
acceptance of mobile payments in Nigeria by exploring the impact of network
externalities in addition to conventional technology acceptance factors. It
posits that performance expectancy, effort expectancy, social influence, trust,
and network externality are the key drivers of mobile payment acceptance. The
research findings indicate that while traditional drivers still have an impact
on customer's willingness to adopt mobile payment, network externalities have
the strongest influence. The paper provides recommendations for future
research, although the results did not support the impact of effort expectancy.",arxiv,Economics,2023,Nigeria
86,86,A Comparison Between Long Short-Term Memory and Hidden Markov Model to Predict Productivity of Maize in Nigeria,"Edesiri Bridget Nkemnole, Victor Adoghe",2023-05-28,http://arxiv.org/pdf/2305.17613v1,"Due to population increase and import constraints, maize, a key cereal crop
in Africa, is experiencing a boom in demand. Given this, the study's focus is
on determining how maize output in Nigeria interacts with various climatic
factors, particularly rainfall and temperature. The Hidden Markov Model (HMM)
and the Long Short-Term Memory neural network (LSTM) are compared in this
context to assess their performance. A variety of performance indicators, such
as correlation, mean absolute percentage error (MAPE), standard error of the
mean (SEM), and mean square error (MSE), are used to evaluate the models. The
outcomes show that the HMM performs better than the LSTM, with an RMSE of 1.21
and a MAPE of 12.98 demonstrating greater performance. Based on this result,
the HMM is then used to forecast maize yield while taking the effects of
temperature and rainfall into account. The estimates highlight the possibility
for increasing local output by demonstrating a favorable environment for maize
planting in Nigeria. In order to help the Nigerian government in its efforts to
increase maize production domestically, these studies offer useful insights.",arxiv,Agricultural Science,2023,Nigeria
87,87,21 new long-term variables in the GX 339-4 field: two years of MeerKAT monitoring,"L. N. Driessen, B. W. Stappers, E. Tremou, R. P. Fender, P. A. Woudt, R. Armstrong, S. Bloemen, P. Groot, I. Heywood, A. Horesh, A. J. van der Horst, E. Koerding, V. A. McBride, J. C. A. Miller-Jones, K. P. Mooley, A. Rowlinson, R. A. M. J. Wijers",2022-03-18,http://arxiv.org/pdf/2203.09806v1,"We present 21 new long-term variable radio sources found commensally in two
years of weekly MeerKAT monitoring of the low-mass X-ray binary GX 339-4. The
new sources vary on time scales of weeks to months and have a variety of light
curve shapes and spectral index properties. Three of the new variable sources
are coincident with multi-wavelength counterparts; and one of these is
coincident with an optical source in deep MeerLICHT images. For most sources,
we cannot eliminate refractive scintillation of active galactic nuclei as the
cause of the variability. These new variable sources represent $2.2\pm0.5$ per
cent of the unresolved sources in the field, which is consistent with the 1-2
per cent variability found in past radio variability surveys. However, we
expect to find short-term variable sources in the field as well as these 21 new
long-term variable sources. We present the radio light curves and spectral
index variability of the new variable sources, as well as the absolute
astrometry and matches to coincident sources at other wavelengths.",arxiv,Astronomy,2022,South Africa
88,88,Towards Supervised and Unsupervised Neural Machine Translation Baselines for Nigerian Pidgin,"Orevaoghene Ahia, Kelechi Ogueji",2020-03-27,http://arxiv.org/pdf/2003.12660v1,"Nigerian Pidgin is arguably the most widely spoken language in Nigeria.
Variants of this language are also spoken across West and Central Africa,
making it a very important language. This work aims to establish supervised and
unsupervised neural machine translation (NMT) baselines between English and
Nigerian Pidgin. We implement and compare NMT models with different
tokenization methods, creating a solid foundation for future works.",arxiv,Computational Linguistics,2020,Nigeria
89,89,Tropospheric delay in microwave propagation in Nigeria,"Samuel Ogunjo, Joseph Dada, Sunday Oluyamo, Ibiyinka Fuwape",2018-11-29,http://arxiv.org/pdf/1811.12055v1,"Satellite communication systems suffer from the systematic error of
tropospheric delay. Accurate estimation of this delay is essential for
communication budget and planning. This study investigates the tropospheric
delay in three Nigeria cities: Abuja, Lagos, Port-Harcourt using two different
models (Saastominen and Hopfield). Three year atmospheric data for surface
pressure, relative humidity and temperature obtained at 5-mins interval were
acquired from the Tropospheric Data Acquisition Network (TRODAN) archives.
Computed radio refractivity values showed distinct seasonal dependence in Abuja
with low and high values during the dry and wet season respectively. The
Hopfield model predicts higher hydrostatic delay values than the Saastominen
model. In the non-hydrostatic delay, the two models converge to a single values
at high temperature. Theorems were proposed with proofs to explain the
relationship observed between the two models.",arxiv,Atmospheric Science,2018,Nigeria
90,90,Forecasting and Uncertainty in Modeling the 2014-2015 Ebola Epidemic in West Africa,"Marisa C. Eisenberg, Joseph N. S. Eisenberg, Jeremy P. D'Silva, Eden V. Wells, Sarah Cherng, Yu-Han Kao, Rafael Meza",2015-01-22,http://arxiv.org/pdf/1501.05555v3,"The Ebola epidemic in West Africa is the largest ever recorded, with over
27,000 cases and 11,000 deaths as of June 2015. The public health response was
challenged by difficulties with disease surveillance, which impacted subsequent
analysis and decision-making regarding optimal interventions. We developed a
stage-structured model of Ebola virus disease (EVD). A key feature of the model
is that it includes a generalized correction term accounting for factors such
as the fraction of cases reported and fraction of the population at risk (e.g.
due to contact patterns, interventions, spatiotemporal spread, pre-existing
immunity, asymptomatic cases, etc.). We generated a range of short-term
forecasts for Guinea, Liberia, and Sierra Leone, which we then validated using
subsequent data. We also used the model to examine the uncertainty in the
relative contributions to transmission by the different stages of infection
(early, late, and funeral). We found that a wide range of forecasted
trajectories fit approximately equally well to the early data. However, by
including the correction factor term the best-fit models correctly forecasted
EVD activity for all three countries, both individually and for all countries
combined. In particular, the model correctly forecasted the slow-down in
Liberia, as well as the continued exponential growth in Sierra Leone through
November 2014. Parameter unidentifiability issues hindered estimation of the
relative contributions of each stage of transmission from incidence and deaths
data alone, which poses a challenge in determining optimal intervention
strategies, and underscores the need for additional data collection. Even with
these limited data, however, it is still possible to accurately capture and
predict the epidemic dynamics by using a simplified correction term that
approximately accounts for the complex underlying factors driving disease
spread.",arxiv,Epidemiology,2015,"Guinea, Liberia, Sierra Leone"
91,91,Use of Available Data To Inform The COVID-19 Outbreak in South Africa: A Case Study,"Vukosi Marivate, Herkulaas MvE Combrink",2020-04-02,http://arxiv.org/pdf/2004.04813v2,"The coronavirus disease (COVID-19), caused by the SARS-CoV-2 virus, was
declared a pandemic by the World Health Organization (WHO) in February 2020.
Currently, there are no vaccines or treatments that have been approved after
clinical trials. Social distancing measures, including travel bans, school
closure, and quarantine applied to countries or regions are being used to limit
the spread of the disease and the demand on the healthcare infrastructure. The
seclusion of groups and individuals has led to limited access to accurate
information. To update the public, especially in South Africa, announcements
are made by the minister of health daily. These announcements narrate the
confirmed COVID-19 cases and include the age, gender, and travel history of
people who have tested positive for the disease. Additionally, the South
African National Institute for Communicable Diseases updates a daily
infographic summarising the number of tests performed, confirmed cases,
mortality rate, and the regions affected. However, the age of the patient and
other nuanced data regarding the transmission is only shared in the daily
announcements and not on the updated infographic. To disseminate this
information, the Data Science for Social Impact research group at the
University of Pretoria, South Africa, has worked on curating and applying
publicly available data in a way that is computer-readable so that information
can be shared to the public - using both a data repository and a dashboard.
Through collaborative practices, a variety of challenges related to publicly
available data in South Africa came to the fore. These include shortcomings in
the accessibility, integrity, and data management practices between
governmental departments and the South African public. In this paper, solutions
to these problems will be shared by using a publicly available data repository
and dashboard as a case study.",arxiv,Public Health,2020,South Africa
