,Unnamed: 0,Title,Author,Publication_Year,Link,Abstract,Repository,Topic_Category,Year,Country(s)
125,125,A different approach for choosing a threshold in peaks over threshold,"Andréhette Verster, Lizanne Raubenheimer",2020-06-10,http://arxiv.org/pdf/2006.05748v1,"Abstract In Extreme Value methodology the choice of threshold plays an
important role in efficient modelling of observations exceeding the threshold.
The threshold must be chosen high enough to ensure an unbiased extreme value
index but choosing the threshold too high results in uncontrolled variances.
This paper investigates a generalized model that can assist in the choice of
optimal threshold values in the \gamma positive domain. A Bayesian approach is
considered by deriving a posterior distribution for the unknown generalized
parameter. Using the properties of the posterior distribution allows for a
method to choose an optimal threshold without visual inspection.",arxiv,Statistics,2020,No country is mentioned in the abstract.
126,126,Reaping the Rewards Later: How Education Improves Old-Age Cognition in South Africa,"Plamen Nikolov, Steve Yeh",2021-09-05,http://arxiv.org/pdf/2109.02177v2,"Cognition, a component of human capital, is fundamental for decision-making,
and understanding the causes of human capital depreciation in old age is
especially important in aging societies. Using various proxy measures of
cognitive performance from a longitudinal survey in South Africa, we study how
education affects cognition in late adulthood. We show that an extra year of
schooling improves memory performance and general cognition. We find evidence
of heterogeneous effects by gender: the effects are stronger among women. We
explore potential mechanisms, and we show that a more supportive social
environment, improved health habits, and reduced stress levels likely play a
critical role in mediating the beneficial effects of educational attainment on
cognition among the elderly.",arxiv,Education Studies,2021,South Africa
127,127,Which country epitomizes the world? A study from the perspective of demographic composition,"Takahiro Yoshida, Rim Er-Rbib, Morito Tsutsumi",2018-09-29,http://arxiv.org/pdf/1810.00210v1,"Demographic indicators are an essential element in considering various
problems in the social economy, such as predicting economic fluctuations and
establishing policies. The literature widely discusses the growth of the world
population or issues pertaining to its aging, but has given little to no
attention to population structures and transition patterns. In this article, we
take advantage of the characteristics of compositional data to examine the
transition of the world population structure. Using the Aitchison distance, we
examine the similarity of the world population structure from the 1990s to 2080
and that of countries and regions in 2015 and create maps to illustrate the
results. Accordingly, we identify the following countries and regions as
epitomes of the world population structure through different periods: India,
Northern Africa and South Africa, in the 1990s, South America in 2015 to 2030,
Oceania and Northern America in 2040, Uruguay and Puerto Rico in 2050 to 2060,
and Italy and Japan in the distant future. We then cluster countries based on
the similarity of their population structures in 2015 and correspond each
cluster to a certain period. We found that Russia and Western Europe gather in
a cluster that does not correspond to any period, indicating a recessive
population structure.",arxiv,Demography,2018,"India, Uruguay, Puerto Rico, Italy, Japan, Russia"
128,128,"Impact of Culture on the Adoption of Diabetes Self-Management Applications: Cape Flats, South Africa",Fazlyn Petersen,2021-08-23,http://arxiv.org/pdf/2108.09953v1,"Diabetes is a global health problem with a high mortality rate. The research
indicates low levels of technology use amongst diabetic patients in low
socioeconomic environments and minority groups. We posit that the culture of
patients is a potential reason for the low adoption and use of technology.
However, research on the proliferation of culture at an individual level is
limited. Therefore, this paper assessed the influence of culture on mobile
application adoption and use amongst diabetic patients in the Cape Flats, South
Africa. This study used key constructs from the Theory of Planned Behaviour
(TPB) and Hofstede's cultural dimensions. It was analysed using survey data
from 439 respondents using purposive sampling. It was found that the dimensions
of Hofstede and the Theory of Planned Behaviour can identify how culture
influences mobile application adoption of diabetic patients in the geographical
Cape Flats area. However, this research indicates a stronger relationship
between culture and diabetes self-management activities than culture and the
adoption of mobile applications.",arxiv,Public Health,2021,South Africa
129,129,"Report of the Notre Dame Contribution to the African School of Fundamental Physics and Applications 2022 in Gqeberha, South Africa","Kenneth Cecire, Shane Wood",2023-04-06,http://arxiv.org/pdf/2304.03095v1,"From November 26 to December 12, 2022, Shane Wood and Kenneth Cecire,
QuarkNet staff members under the University of Notre Dame, traveled to South
Africa as Lecturers in the African School of Fundamental Physics and
Applications (ASP) 2022, held at Nelson Mandela University in Gqeberha (Port
Elizabeth) within the same calendar period. ASP is held every other year in a
different African country for two or three weeks for African graduate and
advanced undergraduate physics students to expose them to cutting-edge physics
content and analysis techniques that may not be as available in their home
institutions. Since 2016, there has been an outreach component consisting of
the High School Teachers and Learners Programs. Cecire and Wood were
facilitators of these programs and also acted as lecturers for two regular ASP
classes. (We will use the term ""student"" to refer to these university students
and ""learners"" to refer to high school students, following the practice of
ASP.) They played a very active role and were quite busy during their two-week
involvement. The mission was successful in terms of reaching teachers,
learners, and students with new and exciting ideas and in terms of building
strong collaborative relationships.",arxiv,Physics,2023,South Africa
130,130,On the Pauli group on 2-qubits in dynamical systems with pseudofermions,"Fabio Bagarello, Yanga Bavuma, Francesco G. Russo",2023-08-09,http://arxiv.org/pdf/2308.05185v1,"The group of matrices $P_1$ of Pauli is a finite 2-group of order 16 and
plays a fundamental role in quantum information theory, since it is related to
the quantum information on the 1-qubit. Here we show that both $P_1$ and the
Pauli 2-group $P_2$ of order 64 on 2-qubits, other than in quantum computing,
can also appear in dynamical systems which are described by non self-adjoint
Hamiltonians. This will allow us to represent $P_1$ and $P_2$ in terms of
pseudofermionic operators.",arxiv,Quantum Physics,2023,No country names are mentioned in the abstract.
131,131,"A spatial analysis of COVID-19 reported cases in the Gauteng province, South Africa: Identifying wards to be targeted early in future infectious diseases outbreak","Mahdi Salehi, Samuel Manda, Mohammad Arashi, Andriette Bekker",2023-11-29,http://arxiv.org/pdf/2311.17430v1,"The COVID-19 pandemic caused major disruptions and contributed to the loss of
livelihoods and income. The pandemic also provided public health and health
systems policy shifts towards better promotion and protection in responding to
such disasters and emergencies. Due to differing effects of socio-economic
infectious disease vulnerabilities and pre-pandemic levels of preparedness for
health emergencies, health system strengthening requires targeted and ununiform
implementation. We employ spatial statistical methods on the COVID-19 confirmed
cases in identifying wards that could be targeted for strengthening health
security in the Gauteng Province, South Africa. In this way, the identified
high-risk wards would be more effective and prepared to respond to future
pandemics and emergencies.",arxiv,Public Health,2023,South Africa
132,132,"Educational Assortative Mating and Household Income Inequality: Evidence from Brazil, Indonesia, Mexico, and South Africa",Ana Kujundzic,2025-03-04,http://arxiv.org/pdf/2503.02713v1,"This paper presents new empirical evidence from four emerging economies on
the relationship between educational assortative mating and household income
inequality. Using a methodological approach that allows for studying marital
sorting patterns without imposing restrictive assumptions about search
frictions, the study finds that people in Brazil, Indonesia, Mexico, and South
Africa tend to sort into internally homogeneous marriages based on education
level. While educational sorting has a noticeable impact on household income
inequality in any given year, changes in the degree of sorting over time barely
have any impact on inequality. Further analysis reveals that this
counterintuitive result is due to different dynamics within educational groups.
The inequality-decreasing impact from reduced sorting among the highly educated
is almost entirely offset by the inequality-increasing impact from increased
sorting among the least educated. While it is certainly reassuring that
concerns about educational assortative mating having a potentially large effect
on income disparities between households appear to be unwarranted, these
findings suggest another concerning narrative. Marginalization processes are
occurring at low levels of the educational distribution. The least educated are
being left behind, facing limited labor market opportunities and diminished
chances of achieving upward socioeconomic mobility through marriage to more
educated partners.",arxiv,Sociology,2025,"Brazil, Indonesia, Mexico, South Africa"
133,133,Statistical Study of Sensor Data and Investigation of ML-based Calibration Algorithms for Inexpensive Sensor Modules: Experiments from Cape Point,"Travis Barrett, Amit Kumar Mishra",2025-03-09,http://arxiv.org/pdf/2503.13487v1,"In this paper we present the statistical analysis of data from inexpensive
sensors. We also present the performance of machine learning algorithms when
used for automatic calibration such sensors. In this we have used low-cost
Non-Dispersive Infrared CO$_2$ sensor placed at a co-located site at Cape
Point, South Africa (maintained by Weather South Africa). The collected
low-cost sensor data and site truth data are investigated and compared. We
compare and investigate the performance of Random Forest Regression, Support
Vector Regression, 1D Convolutional Neural Network and 1D-CNN Long Short-Term
Memory Network models as a method for automatic calibration and the statistical
properties of these model predictions. In addition, we also investigate the
drift in performance of these algorithms with time.",arxiv,Computer Science,2025,South Africa
134,134,A new multi-metric approach for quantifying global biodiscovery and conservation priorities reveals overlooked hotspots for amphibians,"Sky Button, Amaël Borzée",2023-08-17,http://arxiv.org/pdf/2308.08829v1,"Undocumented species represent one of the largest hurdles for conservation
efforts due to the uncertainty they introduce into conservation planning. Until
the distribution of earth's biodiversity is better understood, substantial
conjecture will continue to be required for protecting species from
anthropogenic extinction. Therefore, we developed a novel approach for
identifying regions with promising biodiscovery prospects, linked to
integrative conservation priorities, which we illustrate using amphibians. Our
approach builds on previous estimates of biodiscovery priorities by
simultaneously (1) considering linkages between spatio-environmental variables
and biodiversity, (2) accounting for the negative relationship between past
sampling intensity and future biodiscovery potential, (3) incorporating a
priori knowledge about global species distribution patterns, (4) addressing
spatial autocorrelation in community composition, and (5) weighting theoretical
undocumented species by their predicted levels of conservation need. Using
boosted regression trees and 50km^2 map pixels spread across the global range
of amphibians, we identified several regions likely to contain many
undocumented amphibian species and conservation needs, including the Southeast
Asian Archipelago, humid portions of sub-Saharan Africa, and undersampled
portions of the Amazon, Andes Mountains, and Central America. We also ranked
top-scoring ecoregions by their mean and maximum biodiscovery potential and
found that the top-20 ranked ecoregions were most concentrated in the Southeast
Asian Archipelago and tropical Africa for undocumented species richness, and in
tropical Africa and tropical South America for integrative undocumented
amphibian conservation needs. However, high-scoring pixels tended to be widely
distributed across different ecoregions for both biodiscovery scoring
approaches.",arxiv,Environmental Science,2023,No specific country names are mentioned in the abstract.
135,135,Deformation dependence of the isovector giant dipole resonance: The neodymium isotopic chain revisited,"L. M. Donaldson, C. A. Bertulani, J. Carter, V. O. Nesterenko, P. von Neumann-Cosel, R. Neveling, P. -G. Reinhard, I. T. Usman, P. Adsley, J. W. Brummer, E. Z. Buthelezi, G. R. J. Cooper, R. W. Fearick, S. V. Förtsch, H. Fujita, Y. Fujita, M. Jingo, W. Kleinig, C. O. Kureba, J. Kvasil, M. Latif, K. C. W. Li, J. P. Mira, F. Nemulodi, P. Papka, L. Pellegri, N. Pietralla, V. Yu. Ponomarev, A. Richter, E. Sideras-Haddad, F. D. Smit, G. F. Steyn, J. A. Swartz, A. Tamii",2016-12-20,http://arxiv.org/pdf/1612.06819v3,"Proton inelastic scattering experiments at energy E_p = 200 MeV and a
spectrometer scattering angle of 0 degree were performed on 144,146,148,150Nd
and 152Sm exciting the IsoVector Giant Dipole Resonance (IVGDR). Comparison
with results from photo-absorption experiments reveals a shift of resonance
maxima towards higher energies for vibrational and transitional nuclei. The
extracted photo-absorption cross sections in the most deformed nuclei, 150Nd
and 152Sm, exhibit a pronounced asymmetry rather than a distinct double-hump
structure expected as a signature of K-splitting. This behaviour can be related
to the proximity of these nuclei to the critical point of the phase shape
transition from vibrators to rotors with a soft quadrupole deformation
potential. Self-consistent random-phase approximation (RPA) calculations using
the SLy6 Skyrme force provide a relevant description of the IVGDR shapes
deduced from the present data",arxiv,Nuclear Physics,2016,None
136,136,Nuclear level densities and $γ$-ray strength functions of $^{87}\mathrm{Kr}$ -- First application of the Oslo Method in inverse kinematics,"V. W. Ingeberg, S. Siem, M. Wiedeking, K. Sieja, D. L. Bleuel, C. P. Brits, T. D. Bucher, T. S. Dinoko, J. L. Easton, A. Görgen, M. Guttormsen, P. Jones, B. V. Kheswa, N. A. Khumalo, A. C. Larsen, E. A. Lawrie, J. J. Lawrie, S. N. T. Majola, K. L. Malatji, L. Makhathini, B. Maqabuka, D. Negi, S. P. Noncolela, P. Papka, E. Sahin, R. Schwengner, G. M. Tveten, F. Zeiser, B. R. Zikhali",2018-06-26,http://arxiv.org/pdf/1806.09991v5,"The $\gamma$-ray strength function ($\gamma$SF) and nuclear level density
(NLD) have been extracted for the first time from inverse kinematic reactions
with the Oslo Method. This novel technique allows measurements of these
properties across a wide range of previously inaccessible nuclei.
Proton-$\gamma$ coincidence events from the $\mathrm{d}(^{86}\mathrm{Kr},
\mathrm{p}\gamma)^{87}\mathrm{Kr}$ reaction were measured at iThemba LABS and
the $\gamma$SF and NLD in $^{87}\mathrm{Kr}$ obtained. The low-energy region of
the $\gamma$SF is compared to Shell Model calculations which suggest this
region to be dominated by M1 strength. The $\gamma$SF and NLD are used as input
parameters to Hauser-Feshbach calculations to constrain $(\mathrm{n},\gamma)$
cross sections of nuclei using the TALYS reaction code. These results are
compared to $^{86}\mathrm{Kr}(n,\gamma)$ data from direct measurements.",arxiv,Nuclear Physics,2018,South Africa
137,137,Isoscalar giant monopole resonance in $^{24}$Mg and $^{28}$Si: Effect of coupling between the isoscalar monopole and quadrupole strength,"A. Bahini, V. O. Nesterenko, I. T. Usman, P. von Neumann-Cosel, R. Neveling, J. Carter, J. Kvasil, A. Repko, P. Adsley, N. Botha, J. W. Brummer, L. M. Donaldson, S. Jongile, T. C. Khumalo, M. B. Latif, K. C. W. Li, P. Z. Mabika, P. T. Molema, C. S. Moodley, S. D. Olorunfunmi, P. Papka, L. Pellegri, B. Rebeiro, E. Sideras-Haddad, F. D. Smit, S. Triambak, J. J. van Zyl, .",2021-11-13,http://arxiv.org/pdf/2111.07105v1,"Background: In highly deformed nuclei, there is a noticeable coupling of the
Isoscalar Giant Monopole Resonance (ISGMR) and the $K = 0$ component of the
Isoscalar Giant Quadrupole Resonance (ISGQR), which results in a double peak
structure of the isoscalar monopole (IS0) strength (a narrow low-energy
deformation-induced peak and a main broad ISGMR part). The energy of the narrow
low-lying IS0 peak is sensitive to both the incompressibility modulus
$K_\infty$ and the coupling between IS0 and isoscalar quadrupole (IS2)
strength.
  Objective: This study aims to investigate the two-peaked structure of the
ISGMR in the prolate $^{24}$Mg and oblate $^{28}$Si nuclei and identify among a
variety of energy density functionals based on Skyrme parameterisations the one
which best describes the experimental data. This will allow for conclusions
regarding the nuclear incompressibility. Because of the strong IS0/IS2
coupling, the deformation splitting of the ISGQR will also be analysed.
  Methods: The ISGMR was excited in $^{24}$Mg and $^{28}$Si using
$\alpha$-particle inelastic scattering measurements acquired with an $E_\alpha
= 196$ MeV beam at scattering angles $\theta_{\text{Lab}} = 0^\circ$ and
$4^\circ$. The K$600$ magnetic spectrometer at iThemba LABS was used to detect
and momentum analyse the inelastically scattered $\alpha$ particles. An
experimental energy resolution of $\approx 70$ keV (FWHM) was attained,
revealing fine structure in the excitation-energy region of the ISGMR. The IS0
strength distributions in the nuclei studied were obtained with the
Difference-of-Spectrum (DoS) technique. The theoretical comparison is based on
the quasiparticle random-phase approximation (QRPA) with a representative set
of Skyrme forces.",arxiv,Nuclear Physics,2021,South Africa
138,138,Evolution of the isoscalar giant monopole resonance in the Ca isotope chain,"S. D. Olorunfunmi, R. Neveling, J. Carter, P. von Neumann-Cosel, I. T. Usman, P. Adsley, A. Bahini, L. P. L. Baloyi, J. W. Brümmer, L. M. Donaldson, H. Jivan, N. Y. Kheswa, K. C. W. Li, D. J. Marín-Lámbarri, P. T. Molema, C. S. Moodley, G. G. O'Neill, P. Papka, L. Pellegri, V. Pesudo, E. Sideras-Haddad, F. D. Smit, G. F. Steyn, A. A. Aava, F. Diel, F. Dunkel, P. Jones, V. Karayonchev",2022-02-01,http://arxiv.org/pdf/2202.00722v1,"Two recent studies of the evolution of the isoscalar giant monopole resonance
(ISGMR) within the calcium isotope chain report conflicting results. One study
suggests that the monopole resonance energy, and thus the incompressibility of
the nucleus $K_{A}$ increase with mass, which implies that $K_{\tau}$, the
asymmetry term in the nuclear incompressibility, has a positive value. The
other study reports a weak decreasing trend of the energy moments, resulting in
a generally accepted negative value for $K_{\tau}$. An independent measurement
of the central region of the ISGMR in the Ca isotope chain is provided to gain
a better understanding of the origin of possible systematic trends.
Inelastically scattered $\alpha$ particles from a range of calcium targets
($\mathrm{^{40,42,44,48}Ca}$), observed at small scattering angles including
0$^\circ$, were momentum analyzed in the K600 magnetic spectrometer at iThemba
LABS, South Africa. Monopole strengths spanning an excitation-energy range
between 9.5 and 25.5 MeV were obtained using the difference-of-spectra (DoS)
technique. The structure of the $E0$ strength distributions of $^{40,42,44}$Ca
agrees well with the results from the previous measurement that supports a weak
decreasing trend of the energy moments, while no two datasets agree in the case
of $^{48}$Ca. Despite the variation in the structural character of $E0$
strength distribution from different studies, we find for all datasets that the
moment ratios, calculated from the ISGMR strength in the excitation-energy
range that defines the main resonance region, display at best only a weak
systematic sensitivity to a mass increase. Different trends observed in the
nuclear incompressibility are caused by contributions to the $E0$ strength
outside of the main resonance region, and in particular for high excitation
energies.",arxiv,Nuclear Physics,2022,South Africa
139,139,Rice Plant Disease Detection and Diagnosis using Deep Convolutional Neural Networks and Multispectral Imaging,"Yara Ali Alnaggar, Ahmad Sebaq, Karim Amer, ElSayed Naeem, Mohamed Elhelw",2023-09-11,http://arxiv.org/pdf/2309.05818v1,"Rice is considered a strategic crop in Egypt as it is regularly consumed in
the Egyptian people's diet. Even though Egypt is the highest rice producer in
Africa with a share of 6 million tons per year, it still imports rice to
satisfy its local needs due to production loss, especially due to rice disease.
Rice blast disease is responsible for 30% loss in rice production worldwide.
Therefore, it is crucial to target limiting yield damage by detecting rice
crops diseases in its early stages. This paper introduces a public
multispectral and RGB images dataset and a deep learning pipeline for rice
plant disease detection using multi-modal data. The collected multispectral
images consist of Red, Green and Near-Infrared channels and we show that using
multispectral along with RGB channels as input archives a higher F1 accuracy
compared to using RGB input only.",arxiv,Computer Science,2023,Egypt
140,140,Lecture Notes from the NaijaCoder Summer Camp,"Daniel Alabi, Joseph Ekpenyong, Alida Monaco",2024-09-02,http://arxiv.org/pdf/2409.01499v1,"The NaijaCoder in-person summer camps are intensive programs for high school
and pre-college students in Nigeria. The programs are meant to provide free
instruction on the basics of algorithms and computer programming. In 2024, the
camps were held in two locations within the country: (i) the Federal Capital
Territory (F.C.T.), Abuja; and (ii) Lagos state. Both locations relied on the
same set of notes for instructional purposes. We are providing these notes in a
publicly-available medium for both students and teachers to review after the
main in-person programs are over.",arxiv,Computer Science,2024,Nigeria
141,141,A Comprehensive Analytical Review on Cybercrime in West Africa,"Victor Adewopo, Sylvia Worlali Azumah, Mustapha Awinsongya Yakubu, Emmanuel Kojo Gyamfi, Murat Ozer, Nelly Elsayed",2024-01-07,http://arxiv.org/pdf/2402.01649v1,"Cybercrime is a growing concern in West Africa due to the increasing use of
technology and internet penetration in the region. Legal frameworks are
essential for guiding the control of cybercrime. However, the implementation
proves challenging for law enforcement agencies due to the absence of a
dedicated and effective regional institutional follow-up mechanism. This study
conducted a systematic literature review focusing on West Africa's prevalence
of cybercrime, governing policies, regulations, and methodologies for combating
cybercrime. West-Africa countries face significant cybercrime challenges,
exacerbated by inadequate resources and a dearth of security experts. This
study pinpoints potential cybercrime prevention strategies, such as leveraging
the Triage framework and broadening research to cover pivotal areas like cyber
aggression and cyberbullying. Our research findings highlight the urgency for
policymakers and law enforcement agencies to devise more efficient prevention
strategies and policies. Overall, this study provides invaluable insights into
the state of cybercrime in West Africa to guide the formulation of potent
prevention and intervention strategies.",arxiv,Cybersecurity,2024,West Africa
142,142,Digraphie des langues ouest africaines : Latin2Ajami : un algorithme de translitteration automatique,"El hadji M. Fall, El hadji M. Nguer, Bao Diop Sokhna, Mouhamadou Khoule, Mathieu Mangeot, Mame T. Cisse",2020-05-05,http://arxiv.org/pdf/2005.02827v1,"The national languages of Senegal, like those of West Africa country in
general, are written with two alphabets : the Latin alphabet that draws its
strength from official decreesm and the completed Arabic script (Ajami),
widespread and well integrated, that has little institutional support. This
digraph created two worlds ignoring each other. Indeed, Ajami writing is
generally used daily by populations from Koranic schools, while writing with
the Latin alphabet is used by people from the public school. To solve this
problem, it is useful to establish transliteration tools between these two
scriptures. Preliminary work (Nguer, Bao-Diop, Fall, khoule, 2015) was
performed to locate the problems, challenges and prospects. This present work,
making it subsequently fell into this. Its objective is the study and creation
of a transliteration algorithm from latin towards Ajami.",arxiv,Linguistics,2020,Senegal
